{
  "contract_version": "0.3.0",
  "query_id": "q_20260924T101500Z_3fa9c1",
  "site_id": "teesta",
  "population_persons": {
    "value": 0,
    "low": 0,
    "high": 0,
    "unit": "persons",
    "interval": "zone_range",
    "kind": "predicted",
    "confidence": "MODERATE",
    "basis": "value = \u03a3 p \u00d7 pop; low = HIGH zone; high = HIGH + POSSIBLE"
  },
  "assets": {
    "buildings": {
      "high": 0,
      "possible": 0
    },
    "roads_m": {
      "high": 0.0,
      "possible": 0.0
    },
    "bridges": {
      "high": 0,
      "possible": 0
    },
    "hospitals": {
      "high": 0,
      "possible": 0
    },
    "schools": {
      "high": 0,
      "possible": 0
    },
    "cropland_m2": {
      "high": 0.0,
      "possible": 0.0
    },
    "hydropower": [
      {
        "name": "Teesta III",
        "zone": "high",
        "depth_m": {
          "value": 0.0,
          "low": 0.0,
          "high": 0.0,
          "unit": "m",
          "interval": "P10-P90",
          "kind": "predicted",
          "confidence": "MODERATE"
        }
      }
    ]
  },
  "loss_inr": {
    "value": 0,
    "low": 0,
    "high": 0,
    "unit": "INR",
    "interval": "P10-P90",
    "kind": "predicted",
    "confidence": "MODERATE",
    "by_asset_class": {},
    "assumptions": [
      "damage curves: src_031",
      "asset values: src_032"
    ]
  },
  "warning_table": [
    {
      "poi_id": "teesta__poi__chungthang",
      "name": "Chungthang",
      "kind": "village",
      "chainage_m": 12000.0,
      "zone": "high",
      "p_inundation": 0.95,
      "arrival_s": {
        "value": 0,
        "low": 0,
        "high": 0,
        "unit": "s",
        "interval": "P10-P90",
        "kind": "predicted",
        "confidence": "MODERATE"
      },
      "depth_m": {
        "value": 0.0,
        "low": 0.0,
        "high": 0.0,
        "unit": "m",
        "interval": "P10-P90",
        "kind": "predicted",
        "confidence": "MODERATE"
      },
      "velocity_ms": {
        "value": 0.0,
        "low": 0.0,
        "high": 0.0,
        "unit": "ms",
        "interval": "P10-P90",
        "kind": "predicted",
        "confidence": "MODERATE"
      }
    }
  ],
  "not_affected_poi_count": 0,
  "data_coverage_notes": [
    "OSM building coverage is sparse in this valley"
  ],
  "has_placeholders": true,
  "placeholder_fields": [],
  "caveats": [
    {
      "id": "clear_water",
      "severity": "warning",
      "text_key": "caveat_clear_water"
    }
  ],
  "provenance": {
    "method": "gp_emulator",
    "contract_version": "0.3.0",
    "code_version": "mock-0.0.0",
    "solver_versions": {
      "delft3d": "mock-0.0.0",
      "dualsphysics": "mock-0.0.0"
    },
    "run_ids": [
      "teesta__s001__delft3d"
    ],
    "emulator_manifest": "data/teesta/emulator/delft3d/manifest.json",
    "data_sources": [
      "src_003",
      "src_014"
    ],
    "parameters": {
      "n_samples": 500,
      "seed": 42
    },
    "created_at": "2026-09-24T10:15:00Z"
  }
}
